{
  "$schema": "http://json-schema.org/draft-07/schema#",
  "title": "civ:Credential:GenericId",
  "type": "object",
  "properties": {
    "id": {
      "type": [
        "null",
        "string"
      ]
    },
    "issuer": {
      "type": "string"
    },
    "issued": {
      "type": "string"
    },
    "identifier": {
      "type": "string"
    },
    "expiry": {
      "type": [
        "null",
        "string"
      ]
    },
    "version": {
      "type": "number"
    },
    "type": {
      "type": "array",
      "items": {
        "type": "string"
      }
    },
    "claims": {
      "type": "object",
      "properties": {
        "type": {
          "type": "object",
          "properties": {
            "address": {
              "type": "object",
              "properties": {
                "city": {
                  "type": "string"
                },
                "country": {
                  "type": "string"
                },
                "county": {
                  "type": "string"
                },
                "state": {
                  "type": "string"
                },
                "street": {
                  "type": "string"
                },
                "unit": {
                  "type": "string"
                },
                "zipCode": {
                  "type": "string"
                }
              }
            },
            "documentType": {
              "type": "string"
            },
            "image": {
              "type": "object",
              "properties": {
                "image": {
                  "type": "string"
                },
                "md5": {
                  "type": "string"
                }
              }
            }
          }
        },
        "identity": {
          "type": "object",
          "properties": {
            "dateOfBirth": {
              "type": "object",
              "properties": {
                "day": {
                  "type": "number"
                },
                "month": {
                  "type": "number"
                },
                "year": {
                  "type": "number"
                }
              }
            },
            "name": {
              "type": "object",
              "properties": {
                "first": {
                  "type": "string"
                },
                "last": {
                  "type": "string"
                },
                "middle": {
                  "type": "string"
                },
                "nickname": {
                  "type": "string"
                }
              }
            },
            "givenName": {
              "type": "string"
            },
            "dateOfIssue": {
              "type": "object",
              "properties": {
                "day": {
                  "type": "number"
                },
                "month": {
                  "type": "number"
                },
                "year": {
                  "type": "number"
                }
              }
            },
            "dateOfExpiry": {
              "type": "object",
              "properties": {
                "day": {
                  "type": "number"
                },
                "month": {
                  "type": "number"
                },
                "year": {
                  "type": "number"
                }
              }
            }
          }
        }
      }
    },
    "signature": {
      "type": "object",
      "properties": {
        "type": {
          "type": "string"
        },
        "merkleRoot": {
          "type": "string"
        },
        "anchor": {
          "type": "object",
          "properties": {
            "subject": {
              "type": "object",
              "properties": {
                "pub": {
                  "type": "string"
                },
                "label": {
                  "type": "string"
                },
                "data": {
                  "type": "string"
                },
                "signature": {
                  "type": "string"
                }
              }
            },
            "walletId": {
              "type": "string"
            },
            "cosigners": {
              "type": "array",
              "items": {
                "type": "object"
              }
            },
            "authority": {
              "type": "object",
              "properties": {
                "pub": {
                  "type": "string"
                },
                "path": {
                  "type": "string"
                }
              }
            },
            "coin": {
              "type": "string"
            },
            "tx": {
              "type": "string"
            },
            "network": {
              "type": "string"
            },
            "value": {
              "type": "number"
            },
            "type": {
              "type": "string"
            },
            "civicAsPrimary": {
              "type": "boolean"
            },
            "schema": {
              "type": "string"
            }
          }
        },
        "leaves": {
          "type": "array",
          "items": {
            "type": "object"
          }
        }
      }
    }
  },
  "additionalProperties": false
}